{
  "schemaVersion": "1.0",
  "planId": "sha256:e990d8f99471175e394c3d621746b39a9304a5e11a8e2cff50df2a08c53a74a7",
  "scenarioSlug": "fast-005a-fraud-investigation-advanced",
  "decisionId": "sha256:b2168d8eb950d6da6bd9c4dbcfadcd67219f23e72c4cd12c72e4192c1a5df124",
  "architecture": "hybrid",
  "providerId": "microsoft-fast",
  "dryRun": true,
  "executionAuthorized": false,
  "status": "blocked",
  "generatedAtUtc": "2026-10-15T21:00:00.0000000Z",
  "inputFingerprints": {
    "analysisManifest": "e342a7243af646b359ba1020e7a06c22dc6631fddb18b8165c3d1a26eb7aec63",
    "componentDelta": "c653d20dca6e30929b298cebe9d4377e209a128151ff37be1412b3aaa21dc2ab",
    "coverage": "0433be959a1c9c682ec781f629e128e76bf6c5f94d109b95eedf962600cba304",
    "decision": "6ba1c0fc381f7eae520dc34ae7aa5fd2c0534fa9c0dad75d75cb692af7b2ff0d",
    "dependencies": "d51a7481f50c4330fdf80378f4bcef421cef7cd591f8a28766a3b4b4594eae73",
    "environment": "a37b3c07f20935d2cd501299bef1f3a1f9d922943573b14effdb9854844d4420",
    "packageManifest": "726be9f29a375801b733cf7e73850260136d85dea2448e315f394147952a58e5",
    "schemaPlan": "af909c45d8100db80bb7b1e2eac50e1d15561db413bdc93ca90cc2538d9fa2a0",
    "spec": "346997478cfe76c6cbceb5776739296e50361b0bddd5c5dae8a7667ca2693fd6",
    "traceability": "871321ec441559245c214efdedf885c624b375501f1c7762e2e117848802fbf7"
  },
  "environment": {
    "requiredForArchitecture": true,
    "environmentUrl": "https://powerplatformvscodestarter.crm9.dynamics.com",
    "metadataFingerprint": "7654dbb8de75ccc321fa1959a1546a85016f63a8f3bfca3897c5c055e566ea64",
    "gateOpen": false,
    "status": "action-required",
    "fresh": false,
    "snapshotMatch": true,
    "packageMatch": true,
    "limitations": [
      "Environment evidence is absent or stale.",
      "Environment readiness is 'action-required'."
    ]
  },
  "managedSolutionPolicy": {
    "directManagedModificationAllowed": false,
    "recreateManagedComponentsAllowed": false,
    "extensionRequiresCustomizationEvidence": true,
    "solutionOwnedPrefix": "fiv"
  },
  "componentPlans": [
    {
      "taskId": "FAST006-CREATE-0DACBECAAE9B",
      "action": "CREATE",
      "componentKind": "column",
      "componentIdentity": "fiv_report.fiv_name",
      "displayName": "fiv_name",
      "ownership": "solution-owned",
      "managed": false,
      "directModificationAllowed": false,
      "status": "planned",
      "requirementIds": [],
      "dependencies": [
        "FAST006-CREATE-35B332F9FC3A"
      ],
      "sourceReferences": [],
      "expectedOutputs": [
        "Define solution-owned column 'fiv_name' only after data type and target customization support are approved."
      ],
      "acceptanceChecks": [
        "Column type, requiredness, ownership, and target-table customization support are explicitly validated."
      ],
      "reason": "The approved scenario mapping requires a solution-owned column on a solution-owned table."
    },
    {
      "taskId": "FAST006-CREATE-133A44CE6369",
      "action": "CREATE",
      "componentKind": "view",
      "componentIdentity": "fiv_report:starter-view",
      "displayName": "report starter view",
      "ownership": "solution-owned",
      "managed": false,
      "directModificationAllowed": false,
      "status": "planned",
      "requirementIds": [],
      "dependencies": [
        "FAST006-CREATE-35B332F9FC3A"
      ],
      "sourceReferences": [],
      "expectedOutputs": [
        "Plan a solution-owned view without overwriting an accelerator-managed definition."
      ],
      "acceptanceChecks": [
        "Target table and view ownership are verified."
      ],
      "reason": "A starter view is required for the solution-owned table."
    },
    {
      "taskId": "FAST006-CREATE-186C80CF5CB4",
      "action": "CREATE",
      "componentKind": "column",
      "componentIdentity": "fiv_supervisorapproval.fiv_decision",
      "displayName": "fiv_decision",
      "ownership": "solution-owned",
      "managed": false,
      "directModificationAllowed": false,
      "status": "planned",
      "requirementIds": [],
      "dependencies": [
        "FAST006-CREATE-6AF68DCB8FA5"
      ],
      "sourceReferences": [],
      "expectedOutputs": [
        "Define solution-owned column 'fiv_decision' only after data type and target customization support are approved."
      ],
      "acceptanceChecks": [
        "Column type, requiredness, ownership, and target-table customization support are explicitly validated."
      ],
      "reason": "The approved scenario mapping requires a solution-owned column on a solution-owned table."
    },
    {
      "taskId": "FAST006-CREATE-21481A3AE99D",
      "action": "CREATE",
      "componentKind": "table",
      "componentIdentity": "fiv_fraudscore",
      "displayName": "Fraud Score",
      "ownership": "solution-owned",
      "managed": false,
      "directModificationAllowed": false,
      "status": "planned",
      "requirementIds": [
        "REQ-EXTERNAL-FRAUD-SCORING-INTEGRATION-001"
      ],
      "dependencies": [],
      "sourceReferences": [],
      "expectedOutputs": [
        "Create solution-owned Dataverse table 'fiv_fraudscore' in a future separately authorized build."
      ],
      "acceptanceChecks": [
        "Logical name uses the approved publisher prefix.",
        "No managed or solution-owned table identity conflict exists."
      ],
      "reason": "Approved scenario mapping requires a new solution-owned table not supplied by selected accelerator evidence."
    },
    {
      "taskId": "FAST006-CREATE-252BDE9FB7B3",
      "action": "CREATE",
      "componentKind": "view",
      "componentIdentity": "fiv_investigatorassignment:starter-view",
      "displayName": "investigatorassignment starter view",
      "ownership": "solution-owned",
      "managed": false,
      "directModificationAllowed": false,
      "status": "planned",
      "requirementIds": [],
      "dependencies": [
        "FAST006-CREATE-393A6D2A3E6E"
      ],
      "sourceReferences": [],
      "expectedOutputs": [
        "Plan a solution-owned view without overwriting an accelerator-managed definition."
      ],
      "acceptanceChecks": [
        "Target table and view ownership are verified."
      ],
      "reason": "A starter view is required for the solution-owned table."
    },
    {
      "taskId": "FAST006-CREATE-34EC5D6D74A3",
      "action": "CREATE",
      "componentKind": "form",
      "componentIdentity": "fiv_investigatorassignment:starter-form",
      "displayName": "investigatorassignment starter form",
      "ownership": "solution-owned",
      "managed": false,
      "directModificationAllowed": false,
      "status": "planned",
      "requirementIds": [],
      "dependencies": [
        "FAST006-CREATE-393A6D2A3E6E"
      ],
      "sourceReferences": [],
      "expectedOutputs": [
        "Plan a solution-owned form without overwriting an accelerator-managed definition."
      ],
      "acceptanceChecks": [
        "Target table and form ownership are verified."
      ],
      "reason": "A starter form is required for the solution-owned table."
    },
    {
      "taskId": "FAST006-CREATE-35B332F9FC3A",
      "action": "CREATE",
      "componentKind": "table",
      "componentIdentity": "fiv_report",
      "displayName": "Report",
      "ownership": "solution-owned",
      "managed": false,
      "directModificationAllowed": false,
      "status": "planned",
      "requirementIds": [],
      "dependencies": [],
      "sourceReferences": [],
      "expectedOutputs": [
        "Create solution-owned Dataverse table 'fiv_report' in a future separately authorized build."
      ],
      "acceptanceChecks": [
        "Logical name uses the approved publisher prefix.",
        "No managed or solution-owned table identity conflict exists."
      ],
      "reason": "Approved scenario mapping requires a new solution-owned table not supplied by selected accelerator evidence."
    },
    {
      "taskId": "FAST006-CREATE-393A6D2A3E6E",
      "action": "CREATE",
      "componentKind": "table",
      "componentIdentity": "fiv_investigatorassignment",
      "displayName": "Investigator Assignment",
      "ownership": "solution-owned",
      "managed": false,
      "directModificationAllowed": false,
      "status": "planned",
      "requirementIds": [
        "REQ-INVESTIGATOR-ASSIGNMENT-001"
      ],
      "dependencies": [],
      "sourceReferences": [],
      "expectedOutputs": [
        "Create solution-owned Dataverse table 'fiv_investigatorassignment' in a future separately authorized build."
      ],
      "acceptanceChecks": [
        "Logical name uses the approved publisher prefix.",
        "No managed or solution-owned table identity conflict exists."
      ],
      "reason": "Approved scenario mapping requires a new solution-owned table not supplied by selected accelerator evidence."
    },
    {
      "taskId": "FAST006-CREATE-4BC6D7B48DCE",
      "action": "CREATE",
      "componentKind": "report",
      "componentIdentity": "fast-005a-fraud-investigation-advanced:report:REQ-OPERATIONAL-AND-MANAGEMENT-REPORTING-001",
      "displayName": "operational and management reporting",
      "ownership": "solution-owned",
      "managed": false,
      "directModificationAllowed": false,
      "status": "planned",
      "requirementIds": [
        "REQ-OPERATIONAL-AND-MANAGEMENT-REPORTING-001"
      ],
      "dependencies": [
        "FAST006-CREATE-540020A1AF76"
      ],
      "sourceReferences": [],
      "expectedOutputs": [
        "Create a scenario-owned reporting design only after fields, placement, and ownership are approved."
      ],
      "acceptanceChecks": [
        "accurate reporting"
      ],
      "reason": "The normalized requirement explicitly requests reporting."
    },
    {
      "taskId": "FAST006-CREATE-4E0B645415DF",
      "action": "CREATE",
      "componentKind": "form",
      "componentIdentity": "fiv_supervisorapproval:starter-form",